[
  {
    "id": "simple_question", "description": {"ru": "Короткий однозначный вопрос", "en": "Short unambiguous question"}, "priority": 1,
    "triggers": {"ru": {"strong": ["сколько будет", "кто такой"], "positive": ["что", "кто", "где", "когда"], "weak": ["?"], "negative": ["сравни", "напиши код"], "requiredCombinations": []}, "en": {"strong": ["how much is", "who is"], "positive": ["what", "who", "where", "when"], "weak": ["?"], "negative": ["compare", "write code"], "requiredCombinations": []}},
    "patterns": ["question"], "expectedSlots": ["topic"], "criticalSlots": [], "moduleIds": ["direct_answer_first", "concise_simple"], "incompatibleModuleIds": ["clarify_critical_only"], "bypassRuleIds": ["short_question"], "confidence": {"base": 0.45, "perStrong": 0.2}
  },
  {
    "id": "explanation", "description": {"ru": "Объяснение понятия или процесса", "en": "Explanation of a concept or process"}, "priority": 5,
    "triggers": {"ru": {"strong": ["объясни", "как работает", "простыми словами"], "positive": ["почему", "разъясни"], "weak": ["понять"], "negative": ["только переведи"], "requiredCombinations": []}, "en": {"strong": ["explain", "how does", "in simple terms"], "positive": ["why", "clarify"], "weak": ["understand"], "negative": ["translate only"], "requiredCombinations": []}},
    "patterns": ["explanation_request"], "expectedSlots": ["topic"], "criticalSlots": [], "moduleIds": ["explain_plain", "direct_answer_first", "learning_examples"], "incompatibleModuleIds": [], "bypassRuleIds": [], "confidence": {"base": 0.5, "perStrong": 0.18}
  },
  {
    "id": "definition", "description": {"ru": "Определение термина", "en": "Definition of a term"}, "priority": 6,
    "triggers": {"ru": {"strong": ["что такое", "что означает", "дай определение"], "positive": ["значение термина"], "weak": ["термин"], "negative": ["сравни"], "requiredCombinations": []}, "en": {"strong": ["what is", "what does", "define"], "positive": ["meaning of"], "weak": ["term"], "negative": ["compare"], "requiredCombinations": []}},
    "patterns": ["definition_question"], "expectedSlots": ["topic"], "criticalSlots": [], "moduleIds": ["define_then_example", "concise_simple"], "incompatibleModuleIds": [], "bypassRuleIds": ["short_definition"], "confidence": {"base": 0.55, "perStrong": 0.2}
  },
  {
    "id": "comparison", "description": {"ru": "Сопоставление двух или более объектов", "en": "Comparison of two or more objects"}, "priority": 12,
    "triggers": {"ru": {"strong": ["сравни", "чем отличается", "найди отличия"], "positive": ["разница", "против"], "weak": ["лучше"], "negative": ["не сравнивай"], "requiredCombinations": [["между", "и"]]}, "en": {"strong": ["compare", "difference between", "versus"], "positive": ["differences", " vs "], "weak": ["better"], "negative": ["do not compare"], "requiredCombinations": [["between", "and"]]}},
    "patterns": ["comparison_pair"], "expectedSlots": ["comparison_objects", "use_case"], "criticalSlots": ["comparison_objects"], "moduleIds": ["compare_practical", "compare_table", "compare_tradeoffs", "recommendation_by_scenario", "verify_revisions"], "incompatibleModuleIds": ["concise_simple"], "bypassRuleIds": [], "confidence": {"base": 0.6, "perStrong": 0.16}
  },
  {
    "id": "recommendation", "description": {"ru": "Рекомендация варианта", "en": "Recommendation of an option"}, "priority": 9,
    "triggers": {"ru": {"strong": ["посоветуй", "порекомендуй", "что выбрать"], "positive": ["подскажи вариант", "лучше взять"], "weak": ["лучший"], "negative": ["без рекомендации"], "requiredCombinations": []}, "en": {"strong": ["recommend", "what should i choose", "suggest"], "positive": ["best option", "which one"], "weak": ["best"], "negative": ["no recommendation"], "requiredCombinations": []}},
    "patterns": ["recommendation_request"], "expectedSlots": ["goal", "use_case"], "criticalSlots": [], "moduleIds": ["recommendation_by_scenario", "disclose_assumptions", "rank_options", "avoid_invented_data"], "incompatibleModuleIds": [], "bypassRuleIds": [], "confidence": {"base": 0.48, "perStrong": 0.2}
  },
  {
    "id": "purchase_research", "description": {"ru": "Подбор и исследование товара", "en": "Product selection and purchase research"}, "priority": 13,
    "triggers": {"ru": {"strong": ["подбери", "что купить", "для покупки"], "positive": ["до ", "рублей", "цена", "товар"], "weak": ["модель"], "negative": ["не покупать"], "requiredCombinations": [["купить", "до"]]}, "en": {"strong": ["find me", "what to buy", "buying guide"], "positive": ["under $", "price", "product"], "weak": ["model"], "negative": ["not buying"], "requiredCombinations": [["buy", "under"]]}},
    "patterns": ["product_with_budget"], "expectedSlots": ["product", "budget", "use_case", "region"], "criticalSlots": ["topic"], "moduleIds": ["purchase_criteria", "compare_practical", "price_availability_current", "recommendation_by_scenario", "compare_total_cost"], "incompatibleModuleIds": [], "bypassRuleIds": [], "confidence": {"base": 0.5, "perStrong": 0.2}
  },
  {
    "id": "decision_support", "description": {"ru": "Поддержка решения по критериям", "en": "Criteria-based decision support"}, "priority": 10,
    "triggers": {"ru": {"strong": ["помоги решить", "что лучше выбрать", "прими решение"], "positive": ["критерии выбора", "компромисс"], "weak": ["варианты"], "negative": ["не выбирай"], "requiredCombinations": []}, "en": {"strong": ["help me decide", "which should i choose", "decision support"], "positive": ["selection criteria", "trade-off"], "weak": ["options"], "negative": ["do not choose"], "requiredCombinations": []}},
    "patterns": ["decision_request"], "expectedSlots": ["options", "criteria"], "criticalSlots": [], "moduleIds": ["decision_matrix", "compare_tradeoffs", "disclose_assumptions", "recommendation_by_scenario"], "incompatibleModuleIds": [], "bypassRuleIds": [], "confidence": {"base": 0.45, "perStrong": 0.2}
  },
  {
    "id": "troubleshooting", "description": {"ru": "Поиск причины бытовой или технической проблемы", "en": "Troubleshooting a practical or technical problem"}, "priority": 12,
    "triggers": {"ru": {"strong": ["не работает", "почему сломалось", "вылетает", "зависает"], "positive": ["почини", "проблема", "сбой"], "weak": ["помоги"], "negative": ["работает нормально"], "requiredCombinations": []}, "en": {"strong": ["not working", "keeps crashing", "freezes", "broken"], "positive": ["fix", "problem", "failure"], "weak": ["help"], "negative": ["works fine"], "requiredCombinations": []}},
    "patterns": ["symptom_report"], "expectedSlots": ["error_or_symptom", "expected_result", "environment"], "criticalSlots": ["error_or_symptom"], "moduleIds": ["diagnose_causes", "rank_causes", "safe_checks", "verify_fix", "diagnose_symptoms"], "incompatibleModuleIds": [], "bypassRuleIds": [], "confidence": {"base": 0.55, "perStrong": 0.18}
  },
  {
    "id": "technical_diagnosis", "description": {"ru": "Глубокая диагностика технических симптомов", "en": "Technical diagnosis from observed symptoms"}, "priority": 14,
    "triggers": {"ru": {"strong": ["диагностируй", "найди причину", "симптомы"], "positive": ["звук остаётся", "изображение", "лог"], "weak": ["причина"], "negative": ["без диагностики"], "requiredCombinations": [["причина", "провер"]]}, "en": {"strong": ["diagnose", "find the cause", "symptoms"], "positive": ["audio remains", "image", "log"], "weak": ["cause"], "negative": ["no diagnosis"], "requiredCombinations": [["cause", "check"]]}},
    "patterns": ["technical_symptoms"], "expectedSlots": ["error_or_symptom", "actual_behavior", "expected_behavior"], "criticalSlots": ["error_or_symptom"], "moduleIds": ["diagnose_symptoms", "rank_causes", "safe_checks", "expected_vs_actual", "verify_fix"], "incompatibleModuleIds": [], "bypassRuleIds": [], "confidence": {"base": 0.5, "perStrong": 0.2}
  },
  {
    "id": "programming_generation", "description": {"ru": "Создание программы или кода", "en": "Program or code generation"}, "priority": 14,
    "triggers": {"ru": {"strong": ["напиши программу", "напиши код", "реализуй", "создай скрипт"], "positive": ["функция", "парсер", "компонент", "на python"], "weak": ["код"], "negative": ["не пиши код"], "requiredCombinations": [["напиши", "на"]]}, "en": {"strong": ["write a program", "write code", "implement", "create a script"], "positive": ["function", "parser", "component", "in python"], "weak": ["code"], "negative": ["do not write code"], "requiredCombinations": [["write", "in"]]}},
    "patterns": ["implementation_request"], "expectedSlots": ["purpose", "platform", "programming_language", "input_data", "expected_result"], "criticalSlots": ["purpose", "expected_result"], "moduleIds": ["full_runnable_code", "no_pseudocode", "error_handling", "usage_example", "tests", "preserve_language_tech"], "incompatibleModuleIds": [], "bypassRuleIds": [], "confidence": {"base": 0.58, "perStrong": 0.18}
  },
  {
    "id": "debugging", "description": {"ru": "Исправление ошибки в коде", "en": "Debugging and fixing code"}, "priority": 15,
    "triggers": {"ru": {"strong": ["исправь ошибку", "отладь", "баг в коде"], "positive": ["stack trace", "исключение", "не компилируется"], "weak": ["ошибка"], "negative": ["не исправляй"], "requiredCombinations": [["код", "ошибка"]]}, "en": {"strong": ["fix the error", "debug", "bug in"], "positive": ["stack trace", "exception", "does not compile"], "weak": ["error"], "negative": ["do not fix"], "requiredCombinations": [["code", "error"]]}},
    "patterns": ["code_error"], "expectedSlots": ["code", "error_or_symptom", "expected_result"], "criticalSlots": ["error_or_symptom"], "moduleIds": ["reproduction_steps", "minimal_fix", "verify_fix", "error_handling", "command_exact"], "incompatibleModuleIds": [], "bypassRuleIds": [], "confidence": {"base": 0.6, "perStrong": 0.18}
  },
  {
    "id": "code_review", "description": {"ru": "Проверка качества кода", "en": "Code quality review"}, "priority": 13,